{"cohort":"young_adult","outcomes":["mde_py","mde_severe","suicide_thoughts","suicide_plan","suicide_attempt","spd_py","ami_py","smi_py","ami_and_sud"],"exposures":["alcohol_pm","binge_pm","marijuana_py","marijuana_pm","nicotine_vape_py","nicotine_vape_pm","tobacco_or_vape_py","illicit_py","sud_py","fair_poor_health"],"covariates":["age_band","sex","race_ethnicity_5","poverty"],"pairs":[{"outcome":"mde_py","exposure":"alcohol_pm","year_set":"latest","years":[2024],"weight":"ANALWT2_C1","exposed":{"p":0.18686,"lo":0.16962,"hi":0.20541,"se":0.00891,"n":6239,"suppressed":false,"reason":null},"unexposed":{"p":0.1358,"lo":0.12114,"hi":0.15192,"se":0.00766,"n":7396,"suppressed":false,"reason":null},"diff":0.05106,"diff_se":0.01026,"p_value":1e-05,"or":{"estimate":1.4624,"lo":1.254,"hi":1.7054,"reason":null},"adjusted_or":{"estimate":1.499,"lo":1.2876,"hi":1.7451,"reason":null,"n":13502}},{"outcome":"mde_py","exposure":"alcohol_pm","year_set":"all","years":[2021,2022,2023,2024],"weight":"ANALWT2_C4","exposed":{"p":0.20854,"lo":0.2009,"hi":0.2164,"se":0.00386,"n":26159,"suppressed":false,"reason":null},"unexposed":{"p":0.15333,"lo":0.14579,"hi":0.16118,"se":0.00383,"n":27810,"suppressed":false,"reason":null},"diff":0.05522,"diff_se":0.00483,"p_value":0.0,"or":{"estimate":1.455,"lo":1.3602,"hi":1.5564,"reason":null},"adjusted_or":{"estimate":1.4172,"lo":1.3171,"hi":1.5249,"reason":null,"n":53757}},{"outcome":"mde_py","exposure":"binge_pm","year_set":"latest","years":[2024],"weight":"ANALWT2_C1","exposed":{"p":0.18539,"lo":0.16376,"hi":0.20916,"se":0.0113,"n":3524,"suppressed":false,"reason":null},"unexposed":{"p":0.1509,"lo":0.13748,"hi":0.16538,"se":0.00694,"n":10111,"suppressed":false,"reason":null},"diff":0.03449,"diff_se":0.01182,"p_value":0.00527,"or":{"estimate":1.2806,"lo":1.0869,"hi":1.5088,"reason":null},"adjusted_or":{"estimate":1.2779,"lo":1.0774,"hi":1.5158,"reason":null,"n":13502}},{"outcome":"mde_py","exposure":"binge_pm","year_set":"all","years":[2021,2022,2023,2024],"weight":"ANALWT2_C4","exposed":{"p":0.20731,"lo":0.19801,"hi":0.21693,"se":0.00471,"n":15176,"suppressed":false,"reason":null},"unexposed":{"p":0.16982,"lo":0.16251,"hi":0.17739,"se":0.0037,"n":38793,"suppressed":false,"reason":null},"diff":0.03749,"diff_se":0.00581,"p_value":0.0,"or":{"estimate":1.2785,"lo":1.1854,"hi":1.379,"reason":null},"adjusted_or":{"estimate":1.2255,"lo":1.1306,"hi":1.3283,"reason":null,"n":53757}},{"outcome":"mde_py","exposure":"marijuana_py","year_set":"latest","years":[2024],"weight":"ANALWT2_C1","exposed":{"p":0.23792,"lo":0.21659,"hi":0.26066,"se":0.01097,"n":4788,"suppressed":false,"reason":null},"unexposed":{"p":0.11835,"lo":0.10542,"hi":0.13263,"se":0.00676,"n":8847,"suppressed":false,"reason":null},"diff":0.11957,"diff_se":0.01184,"p_value":0.0,"or":{"estimate":2.3257,"lo":1.9781,"hi":2.7344,"reason":null},"adjusted_or":{"estimate":2.3547,"lo":2.0001,"hi":2.7723,"reason":null,"n":13502}},{"outcome":"mde_py","exposure":"marijuana_py","year_set":"all","years":[2021,2022,2023,2024],"weight":"ANALWT2_C4","exposed":{"p":0.25728,"lo":0.24752,"hi":0.26728,"se":0.00492,"n":19263,"suppressed":false,"reason":null},"unexposed":{"p":0.13664,"lo":0.12924,"hi":0.14439,"se":0.00377,"n":34706,"suppressed":false,"reason":null},"diff":0.12064,"diff_se":0.00621,"p_value":0.0,"or":{"estimate":2.1888,"lo":2.0154,"hi":2.3771,"reason":null},"adjusted_or":{"estimate":2.2133,"lo":2.038,"hi":2.4036,"reason":null,"n":53757}},{"outcome":"mde_py","exposure":"marijuana_pm","year_set":"latest","years":[2024],"weight":"ANALWT2_C1","exposed":{"p":0.24148,"lo":0.21726,"hi":0.26748,"se":0.01251,"n":3219,"suppressed":false,"reason":null},"unexposed":{"p":0.1344,"lo":0.12125,"hi":0.14875,"se":0.00684,"n":10416,"suppressed":false,"reason":null},"diff":0.10707,"diff_se":0.01324,"p_value":0.0,"or":{"estimate":2.0503,"lo":1.7372,"hi":2.4198,"reason":null},"adjusted_or":{"estimate":2.102,"lo":1.7782,"hi":2.4846,"reason":null,"n":13502}},{"outcome":"mde_py","exposure":"marijuana_pm","year_set":"all","years":[2021,2022,2023,2024],"weight":"ANALWT2_C4","exposed":{"p":0.26343,"lo":0.25176,"hi":0.27544,"se":0.00589,"n":13096,"suppressed":false,"reason":null},"unexposed":{"p":0.15327,"lo":0.14609,"hi":0.16074,"se":0.00365,"n":40873,"suppressed":false,"reason":null},"diff":0.11016,"diff_se":0.00708,"p_value":0.0,"or":{"estimate":1.9758,"lo":1.8146,"hi":2.1514,"reason":null},"adjusted_or":{"estimate":2.0361,"lo":1.8745,"hi":2.2117,"reason":null,"n":53757}},{"outcome":"mde_py","exposure":"nicotine_vape_py","year_set":"latest","years":[2024],"weight":"ANALWT2_C1","exposed":{"p":0.20622,"lo":0.18576,"hi":0.22832,"se":0.01059,"n":4393,"suppressed":false,"reason":null},"unexposed":{"p":0.13795,"lo":0.12382,"hi":0.15341,"se":0.00736,"n":9242,"suppressed":false,"reason":null},"diff":0.06827,"diff_se":0.01167,"p_value":0.0,"or":{"estimate":1.6235,"lo":1.3814,"hi":1.908,"reason":null},"adjusted_or":{"estimate":1.5825,"lo":1.3476,"hi":1.8583,"reason":null,"n":13502}},{"outcome":"mde_py","exposure":"nicotine_vape_py","year_set":"all","years":[2022,2023,2024],"weight":"ANALWT2_C3","exposed":{"p":0.22441,"lo":0.2138,"hi":0.23538,"se":0.00537,"n":13379,"suppressed":false,"reason":null},"unexposed":{"p":0.15393,"lo":0.14506,"hi":0.16324,"se":0.00453,"n":27232,"suppressed":false,"reason":null},"diff":0.07048,"diff_se":0.0064,"p_value":0.0,"or":{"estimate":1.5904,"lo":1.4608,"hi":1.7314,"reason":null},"adjusted_or":{"estimate":1.5399,"lo":1.4124,"hi":1.679,"reason":null,"n":40443}},{"outcome":"mde_py","exposure":"nicotine_vape_pm","year_set":"latest","years":[2024],"weight":"ANALWT2_C1","exposed":{"p":0.21434,"lo":0.18955,"hi":0.24141,"se":0.01291,"n":3216,"suppressed":false,"reason":null},"unexposed":{"p":0.14344,"lo":0.12905,"hi":0.15914,"se":0.00749,"n":10419,"suppressed":false,"reason":null},"diff":0.0709,"diff_se":0.01477,"p_value":1e-05,"or":{"estimate":1.6291,"lo":1.3414,"hi":1.9785,"reason":null},"adjusted_or":{"estimate":1.5685,"lo":1.2905,"hi":1.9065,"reason":null,"n":13502}},{"outcome":"mde_py","exposure":"nicotine_vape_pm","year_set":"all","years":[2022,2023,2024],"weight":"ANALWT2_C3","exposed":{"p":0.2325,"lo":0.21952,"hi":0.24601,"se":0.00659,"n":9728,"suppressed":false,"reason":null},"unexposed":{"p":0.16028,"lo":0.15138,"hi":0.16959,"se":0.00453,"n":30883,"suppressed":false,"reason":null},"diff":0.07223,"diff_se":0.00804,"p_value":0.0,"or":{"estimate":1.5872,"lo":1.4347,"hi":1.7558,"reason":null},"adjusted_or":{"estimate":1.5264,"lo":1.3778,"hi":1.691,"reason":null,"n":40443}},{"outcome":"mde_py","exposure":"tobacco_or_vape_py","year_set":"latest","years":[2024],"weight":"ANALWT2_C1","exposed":{"p":0.19644,"lo":0.17892,"hi":0.21523,"se":0.00904,"n":5346,"suppressed":false,"reason":null},"unexposed":{"p":0.13665,"lo":0.12187,"hi":0.15291,"se":0.00772,"n":8289,"suppressed":false,"reason":null},"diff":0.05979,"diff_se":0.01032,"p_value":0.0,"or":{"estimate":1.5445,"lo":1.3274,"hi":1.7972,"reason":null},"adjusted_or":{"estimate":1.5468,"lo":1.3323,"hi":1.7959,"reason":null,"n":13502}},{"outcome":"mde_py","exposure":"tobacco_or_vape_py","year_set":"all","years":[2022,2023,2024],"weight":"ANALWT2_C3","exposed":{"p":0.21342,"lo":0.20387,"hi":0.22329,"se":0.00483,"n":16303,"suppressed":false,"reason":null},"unexposed":{"p":0.15316,"lo":0.14394,"hi":0.16287,"se":0.00471,"n":24308,"suppressed":false,"reason":null},"diff":0.06025,"diff_se":0.00588,"p_value":0.0,"or":{"estimate":1.5001,"lo":1.3829,"hi":1.6273,"reason":null},"adjusted_or":{"estimate":1.5045,"lo":1.3853,"hi":1.634,"reason":null,"n":40443}},{"outcome":"mde_py","exposure":"illicit_py","year_set":"latest","years":[2024],"weight":"ANALWT2_C1","exposed":{"p":0.23873,"lo":0.21807,"hi":0.2607,"se":0.01061,"n":5159,"suppressed":false,"reason":null},"unexposed":{"p":0.11157,"lo":0.09973,"hi":0.12462,"se":0.00619,"n":8476,"suppressed":false,"reason":null},"diff":0.12716,"diff_se":0.0107,"p_value":0.0,"or":{"estimate":2.4972,"lo":2.1578,"hi":2.89,"reason":null},"adjusted_or":{"estimate":2.5122,"lo":2.1707,"hi":2.9074,"reason":null,"n":13502}},{"outcome":"mde_py","exposure":"illicit_py","year_set":"all","years":[2021,2022,2023,2024],"weight":"ANALWT2_C4","exposed":{"p":0.25723,"lo":0.24826,"hi":0.26641,"se":0.00452,"n":20654,"suppressed":false,"reason":null},"unexposed":{"p":0.13136,"lo":0.12424,"hi":0.13883,"se":0.00363,"n":33315,"suppressed":false,"reason":null},"diff":0.12587,"diff_se":0.00541,"p_value":0.0,"or":{"estimate":2.29,"lo":2.1257,"hi":2.4671,"reason":null},"adjusted_or":{"estimate":2.3164,"lo":2.1498,"hi":2.4958,"reason":null,"n":53757}},{"outcome":"mde_py","exposure":"sud_py","year_set":"latest","years":[2024],"weight":"ANALWT2_C1","exposed":{"p":0.2818,"lo":0.25533,"hi":0.30988,"se":0.01359,"n":3463,"suppressed":false,"reason":null},"unexposed":{"p":0.11722,"lo":0.10503,"hi":0.13061,"se":0.00636,"n":10172,"suppressed":false,"reason":null},"diff":0.16458,"diff_se":0.01387,"p_value":0.0,"or":{"estimate":2.955,"lo":2.5064,"hi":3.4839,"reason":null},"adjusted_or":{"estimate":3.1206,"lo":2.6413,"hi":3.6868,"reason":null,"n":13502}},{"outcome":"mde_py","exposure":"sud_py","year_set":"all","years":[2021,2022,2023,2024],"weight":"ANALWT2_C4","exposed":{"p":0.29624,"lo":0.28408,"hi":0.3087,"se":0.00613,"n":13865,"suppressed":false,"reason":null},"unexposed":{"p":0.13881,"lo":0.13154,"hi":0.1464,"se":0.0037,"n":40104,"suppressed":false,"reason":null},"diff":0.15743,"diff_se":0.00738,"p_value":0.0,"or":{"estimate":2.6116,"lo":2.3898,"hi":2.854,"reason":null},"adjusted_or":{"estimate":2.7257,"lo":2.4854,"hi":2.9892,"reason":null,"n":53757}},{"outcome":"mde_py","exposure":"fair_poor_health","year_set":"latest","years":[2024],"weight":"ANALWT2_C1","exposed":{"p":0.40363,"lo":0.35583,"hi":0.45333,"se":0.02435,"n":1335,"suppressed":false,"reason":null},"unexposed":{"p":0.13322,"lo":0.1219,"hi":0.14543,"se":0.00585,"n":12293,"suppressed":false,"reason":null},"diff":0.2704,"diff_se":0.02332,"p_value":0.0,"or":{"estim